,Answers,Question
0," Explore the career requirements for application security architects. Get the facts about education requirements, job outlook, and salary to determine if this is the right career for you.",Application Security Architect: Career and Salary Facts
1," An associate's degree program in computer forensics, cybercrime or criminal justice combines the study of crime prevention with computer science knowledge. Programs can prepare you for a career as a computer security specialist or a computer...",Associate Degree in Computer Crime Prevention
2," As an information security specialist, you'll learn how to protect computers and computer networks from various Internet-related security threats. Find out what an associate degree program can teach you, get information regarding online study...",Associate Degree in Information Security
3," Explore the career requirements for chief information security officers. Get the facts about job duties, education requirements and salary to determine if this is the right career for you.",Chief Information Security Officer Jobs
4, Learn about the variety of programs in computer forensics available at the master's degree level. Keep reading to learn about the technical and scientific knowledge and hands-on training you'll get through classes and experience requirements. See...,Colleges and Schools for a Master's in Computer Forensics
5, Read on to learn about degree levels and courses you'll take in computer and digital forensics programs. Also find out what type of work you can do after graduation.,Computer and Digital Forensics Degree Programs
6," Computer assurance involves the security and protection of networks. Learn about employment options for those who hold a degree in computer assurance, along with information about the classes offered in these programs, salaries, and an employment...",Computer Assurance Degree Programs
7," Research what it takes to become a computer forensics analyst. Learn about education programs, job duties and potential earnings to find out if this is the career for you.",Computer Forensics Analyst: Salary and Career Facts
8," Computer forensics professionals use computers to aid in criminal investigations, performing such tasks as reconstructing deleted data or analyzing evidence on a computer. Learn about the courses typically found in a bachelor's degree program in...",Computer Forensics Bachelors Degrees: Online and Campus-Based Programs
9," Computer forensics is the analysis of digital evidence, including e-mails and network activity, for legal purposes. Learn about common course topics in computer forensics courses, and find out career options for graduates.",Computer Forensics Classes and Colleges
10," Explore the career requirements for computer forensic examiners. Get the facts about education requirements, certification options, salary, and potential job growth to determine if this is the right career for you.",Computer Forensics Examiner: Career and Salary Facts
11," Computer forensics investigators identify, preserve and analyze digital evidence related to legal matters. Continue reading to learn about job duties, training options and earnings for these investigators.",Computer Forensics Investigator Job Facts
12, Find out about the types of jobs you could pursue in computer forensics. Read on to learn more about career options along with education and salary information.,Computer Forensics Majors: Salary and Career Facts
13," Get information about computer network security degree programs. Learn about degree levels and common courses along with career options, employment outlook and average salary.",Computer Network Security Degrees
14," A computer security associate degree will enable you to design more secure network and desktop systems, among other things. Read on to learn more about what the program teaches you, program requirements, certification choices and career prospects.",Computer Security Associate Degree Programs
15," Find out which majors can prepare you for a career in computer security, and explore job options in the field. Also, learn about available certifications and potential earnings.",Computer Security Majors: Salary and Career Facts
16," Learn how to fight cybercrime - protecting computers and networks from hackers and malicious software - through a master's degree program in computer security. Keep reading to explore program options, online learning in the field, prerequisites...",Computer Security Master's Degrees: Online and Campus-Based Programs
17," A computer security specialist analyzes system security and devises ways to prevent breaches. Get information on what to look for in a school, and find out about the variety of degrees that can prepare you for a career in this field.",Computer Security Specialist Degrees and Schools
18, Corporate aircraft security courses explore how security operates in airports. Read on to learn about relevant education programs as well as potential career options.,Corporate Aircraft Security Courses
19," Explore the career requirements for corporate security specialists. Get the facts about education and certification requirements, salary, and potential job growth to determine if this is the right career for you.",Corporate Security Jobs: Salary and Career Facts
20," Gain information about corporate security degree programs. Learn about what a degree in corporate security involves, and about careers in cybersecurity, risk management, and facility management.",Corporate Security Training Programs
21," Research what's required for a career in cyber security. Learn about necessary degrees, career options and potential earnings to find out if this is the career for you.",Cyber Security Career and Salary Facts
22," As a cyber security professional, you'll protect Internet consumers from various threats, such as worms, viruses and hackers. Read on to learn about cyber security courses, online options, how to select a school and potential career paths.",Cyber Security Colleges and Courses
23," Find out what you'd learn in a master's degree program in cyber security, which you can earn through an on-campus or online format. Explore the course topics covered by these programs, the prerequisites for enrollment, and job options in the...",Cyber Security Master's Degrees: Online and Campus-Based Programs
24," The rise of the Internet has led to cybercrime, requiring specialized investigators to apply innovative forensic sciences in the digital world to catch lawbreakers. Find out about the degrees and courses that can prepare you for a career in...",Cybercrime Courses and Schools
25," Students enrolled in cybercrime programs will study concepts and practical applications relating to the fields of criminal justice and computer science. Check the prerequisites for entering a cybercrime program, and review the typical coursework....",Cybercrime Degree and Certificate Programs
26," Explore the career requirements for data security analysts. Get the facts about education and certification requirements, job duties, and salary information to determine if this is the right career for you.",Data Security Analyst: Salary and Career Facts
27," Explore the career requirements for data security supervisors. Get the facts about job duties, education requirements, and typical salary to determine if this is the right career for you.",Data Security Supervisor Jobs: Career and Salary Facts
28," Earning a bachelor's or master's degree in cyber security can train you to protect computer networks from hackers and viruses, and track down people who commit computer crimes. Read more to learn more about online study options, common course...",Degrees in Cyber Security
29," Learn about what you'd study as an information assurance doctoral student and find out if this program is available online. Review the prerequisites for this degree program, course options, and get info on job options for graduates with a Ph.D....",Doctorate Degree Programs in Information Assurance
30," Students enrolled in graduate certificate programs in information security learn advance techniques for keeping information and online databases secure.  Read on to learn about common topics, prerequisites, the prospective student profile, and...",Graduate Certificate Programs in Information Security
31, Find out about the types of jobs you could pursue as a Certified Information Systems Security Professional. Read on to learn more about career options along with salary and certification information.,How Can I Be a Certified Information Systems Security Professional?
32," Research what it takes to become a computer security expert. Learn about the duties of this job, the education requirements, and salary range to find out if this is the career for you.",How Can I Become a Computer Security Expert?
33," Research what it takes to become a cyber security specialist. Learn about education and certification requirements, job duties and salary to find out if this is the career for you.",How Can I Become a Cyber Security Specialist?
34," Explore the career requirements for becoming an information systems security officer. Learn about the job duties, education requirements, certification, job outlook, and salary information to determine if this is the right career for you.",How Can I Become an Information Systems Security Officer?
35," If you're interested in the growing problem of protecting data, a career in computer data security might be for you. Computer data security professionals keep private, corporate and government information safe from outside attack.",How Can I Learn About Computer Data Security?
36," When you're seeking career advancement in information security and information technology, a certificate or advanced degree is usually required. Earning a certificate in information systems security will teach you about risk management,...",How Do I Earn a Certificate in Information Systems Security?
37, Earning an information security certification shows you have the understanding and skills required to protect computer networks and data systems from security breaches and hackers. It also indicates that your knowledge is current and you can do...,How Do I Earn an Information Security Certification?
38, Information assurance degree programs teach students how to defend a computer network from attack and protect sensitive information stored on computer databases. It's possible to earn your bachelor's degree online or in-person. Read on to learn...,Information Assurance Bachelor's Degrees: Online & Campus-Based Programs
39," A degree in information assurance may be right for you - programs cover cybersecurity and computer network infrastructures. Keep reading to learn about degree and training options, as well as career opportunities.",Information Assurance Degree and Training Programs
40," Explore what it takes to become an information assurance professional. Learn more about education requirements, salary potential, and job outlook to determine if this is the right career for you.",Information Assurance Salary and Career Facts
41," Learn about your undergraduate and graduate degree options in information security. Keep reading to learn more about education and certification options in information security, a career field that will require you to be up-to-date with the...",Information Security Degrees and Certifications
42," Information security officers ensure the safety of computer systems and private data. Read on to learn about information security officer training programs, the online availability of these programs, and the typical coursework.  Get info about...",Information Security Officer Training Programs
43," Learn about information systems security degree programs, including what types of programs are available, what you'll learn, and the outlook for jobs in the field. Keep reading to see what professional certifications are available.",Information Systems Security Degree Programs
44," Explore the career requirements for information systems security managers. Get the facts about education and certification requirements, job duties, and salary information to determine if this is the right career for you.",Information Systems Security Manager: Salary and Career Facts
45, Learn about degree programs and career options for those with training in information technology security. Get the facts about topics covered in classes as well as employment data.,Information Technology Security Certificates
46," Professionals in information technology security implement systems that protect an organization's data. Find out about certificate and degree programs that can prepare you for a career in this field, and see what courses are required.",Information Technology Security Classes and Schools
47," A certificate or degree in network security can prepare you to work as a network administrator, systems analyst or computer security researcher. Learn about these programs and professional certification options.",Internet Security Degrees and Certifications
48," Find out about the types of jobs you could pursue in internet security. Keep reading to learn more about career options, education requirements, earnings, and job prospects.",Internet Security: Career and Salary Facts
49, A master's degree program in cybersecurity or information systems management prepares you to use computer networking and information technology to protect the privacy of corporate information systems. Read on to find out more about what these...,Master's Degrees in Corporate Security
50," A master's degree in Internet security can teach you the skills you need to stop computer attacks and intrusions. You won't typically find a master's degree by this title, but plenty of related graduate degree programs offer training in Internet...",Master's Degrees in Internet Security
51," Earning a degree in computer forensics online can provide you with the education to begin a career in computer security and investigations. Keep reading to learn about online degree programs, online program structure, typical classes and career...",Online Computer Forensics Degree Programs
52, See what courses and programs in computer forensics entail. Keep reading for more details about online degree options that can teach you to recover and analyze information from computers according to investigative and legal standards. Get tips on...,Online Computer Forensics Schools
53, Professionals in the computer security field seek out solutions to computer attacks and hacking. Online degree and certificate programs are available in this field at both the undergraduate and graduate levels. Review the coursework in a computer...,Online Computer Security Degrees and Certificate Programs
54," Cyber security provides the first line of defense for computer networked information against hackers, spyware, viruses and other related attacks. Associate's, bachelor's and master's degree programs are all available online. Read on to learn more...",Online Cyber Security Degree Programs
55," You may want to consider enrolling in an online program in cyber security, more commonly referred to as network and information security. Read on to learn more about possible courses and programs in this field. See what you'll study and what your...",Online Cyber Security Schools
56, Current and aspiring information technology (IT) professionals can find several schools that offer computer information systems (CIS) degree programs and courses online. Read on for prerequisite and program information. Find out more about online...,Online Degrees and Courses in Computer Information Systems
57," Professionals in the information assurance and security field aim to protect private information and thwart hackers. You could pursue an online bachelor's, master's or doctoral degree in information assurance and security. Keep reading to learn...",Online Information Assurance and Security Degrees
58," Learn about online information systems security degree programs and how you can learn to protect computer networks and information from hackers and other security threats. Read about how online programs are structured, topics you'll study, and...",Online Information Systems Security Degree Programs
59, Online certificate or degree programs that cover security topics can prepare you to assist companies with network and computer assessments and solutions. Read on for more information on the types of online programs available related to Internet...,Online Schools in Internet Security
60," As a doctoral student in this field, you might research information phishing, botnets or computer forensics. Read on to find out more about Doctor of Philosophy (Ph.D.) programs in computer security. Explore what classes you'll take, how online...",PhD in Computer Security
61," Explore the curriculum in information security Ph.D. programs, which are heavy on research. Get info on what you'll study as a doctoral student in this field, and review the career opportunities you'd have after completing the degree.",PhD Programs in Information Security
62," Internet security specialists play an important role in helping a business maintain its network integrity. Learn about the various school, program and course options in Internet security training. Online learning is also discussed below.",Schools with Internet Security Training Programs
63," The Symantec Certified Professional (SCP) offers professionals the chance to demonstrate their expertise in matters of cloud security. Get information about SCP's course options and certification exams, and see what the job outlook and salary...",SCP Security Certification
64," Computer security is a broad field of study often intermingled with information security, computer security, information assurance, cyber security and IT security. Find out what to look for in a top computer security school. Compare the program...",Top Computer Security Schools
65," You can earn a Bachelor of Science, Master of Science, Doctor of Philosophy or Professional Graduate Certificate in Computer Science or Engineering. Learn about three of the top information security schools, area specilizations and the...",Top Information Security Schools
66," Explore the typical characteristics of a school with a strong program in computer forensics. Read about three top-ranked schools with programs in this field, and find out what kinds of computer forensics degrees you could pursue at each school.",Top Schools with Computer Forensics Programs
67, Recent graduates of computer security management programs generally find information technology-related jobs. Find out about some of the positions available to those who are looking to get their first job in the field.,What Are Jobs for a Recent Computer Security Management Graduate?
68," If you have a strong interest in maintaining national, corporate or institutional information security, you may find some good program options in cyber security at one of the following top schools.",What are the 3 Top Cyber Security Schools?
69," A degree in computer forensics can lead to a number of careers in the technology world, including computer security and cyber investigation. To learn about the core courses that make up a degree program in computer forensics, continue reading.",What are the Core Courses for a Degree in Computer Forensics?
70," Network administration and security focuses on the creation, management, protection and repair of computer networks. Many of the people who work in this field have at least an associate's degree or a bachelor's degree, such as a Bachelor of...",What Are the Courses in a Network Administration & Security Degree Program?
71," The core courses of most online computer security programs cover programming, encryption and basic protocols. Students also learn about basic and advanced computer security. Read this article to learn more about the courses in online computer...",What Are the Courses in Most Computer Security Online Degree Programs?
72," With the proliferation of wireless devices and technologies, computer hackers have additional avenues for procuring data through illicit means. Many schools provide a variety of courses in wireless Internet security to address this concern, often...",What are Typical Courses in Wireless Internet Security?
73, What are the benefits of earning a computer forensics degree online and what careers are available to graduates? Read on to learn about three schools that offer online programs.,What Colleges Offer a Computer Forensics Degree Program Online?
74," Most information security professionals have completed degree programs that include information security courses as part of the curriculum. Programs in information security, network security, information assurance and related fields are offered...",What Degrees Have Information Security Courses in the Curriculum?
75," A computer security degree program can prepare you for the rapidly emerging field of protecting information within computer systems, networks and online. The integrity, availability and confidentiality of information is the focus of a computer...",What is a Computer Security Degree Program?
76," Explore the career requirements for an information systems security engineer. Get the facts about degree programs, certifications and potential earnings to determine if this is the right career for you.",What is an Information Systems Security Engineer?
77," While it is relatively easy to get information from the Internet, it can be just as easy for others to obtain your personal information. Internet security can be a vital consideration for organizations in the government and business sectors as...",What is an Internet Security Specialist?
78, Computer forensics is a method of extracting and preserving data from a computer so that it can be used in a criminal proceeding as evidence. Read on to find out more about data preservation and practical applications of computer forensics.,What is Computer Forensics?
79," Have you ever wanted to thwart a hacker from entering a computer network? Computer security specialists and managers do just that and more. Read on to learn more about what this field involves, including educational requirements and economic...",What is Computer Security Management?
80," Advances in computer technology have given organizations effective ways to monitor operations and keep members connected, but these advantages have not been without risk. As a data security professional, you ensure that data sent over networks is...",What is Data Security?
81," Design methodology refers to the development of a system or method for a unique situation. Today, the term is most often applied to technological fields in reference to web design, software or information systems design. Read this article to...",What is Design Methodology?
82, Forensic computing is a relatively new discipline in digital crime detection. The term computer forensics was initially used by law enforcement officials in the late 1980's to refer to the analysis of single computers for electronic proof that a...,What is Forensic Computing?
83, Information security is the area of the information technology field that plays a major role in protecting highly confidential information stored on companies' computers. Employers are reaching out to hire talented people trained in information...,What is Information Security?
84," Going beyond the nuts and bolts of firewalls, intrusion detection and routers, a master's degree curriculum in computer security addresses a variety of social and management issues affecting data integrity. Students at the master's level will...",What is the Curriculum of a Master's Degree in Computer Security?
85, Find out about the types of jobs you could pursue in computer forensics. Read on to learn more about career options along with information about where computer forensics specialists work and what education is required.,What Jobs Can I Get in Computer Forensics?
86," The increasing sophistication of electronic crimes requires information security professionals with the most up-to-date schooling available for protecting systems against infiltration. Many traditional colleges, technical schools and online...",What Schooling Is Necessary for a Career in Information Security?
87," Have you ever wondered how law enforcement and technology can come together? Are you curious how evidence is gathered from computers or digital sources? If you answered yes to these questions, then you may be interested in a computer forensics...",What Will I Learn in a Computer Forensics Degree Program?
88," Would you like to outwit hackers and safeguard digital information? If so, you may have an interest in an information technology (IT) security degree program. To find out what educational programs cover so you can prepare for a job in the field,...",What Will I Learn in an IT Security Degree Program?
89, Computer security professionals are often the first line of defense for data protection in the workplace or at home. Read on to find out what is included in the curriculum of a bachelor's degree program in computer security.,What's the Curriculum of a Bachelor's Degree in Computer Security?
90, The field of network security has experienced explosive growth over recent years. More and more organizations need to secure their computer networks to minimize any interruption of service. The professionals who work to ensure that these systems...,What's the Curriculum of a Bachelor's Degree in Network Security?
91," Graduates with an associate's degree in computer security may be prepared for careers in network administration, information technology and other computer-related fields. The typical curriculum of a 2-year computer security program might include...",What's the Curriculum of an Associate's Degree in Computer Security?
