,Answers,Question
92," Nearly every business, public agency and organization relies on computer-based information systems to some extent. These operations include storing credit card numbers, medical records, employee data or other highly sensitive data. Information...",What's the Curriculum of an Online Information Security Degree Program?
93," Graduates with a computer forensics, computer science or accounting degree can become forensic computer analysts at law enforcement agencies, private practices or information technology companies. Read on to learn more about the average starting...",What's the Salary for a Recent Graduate in Computer Forensics?
94," Homes and businesses everywhere use computers, and those computers need protection from attacks and intrusions. Earning a bachelor's degree in information systems security can lead to a career as a network administrator or computer security...",Where Can I Earn a Bachelor's in Information Systems Security?
95," Some network security degree programs are available entirely online. If you are seeking a degree in this field and would prefer a virtual classroom setting, read on to learn about the options offered by two institutions: The University of...",Where Can I Earn a Network Security Degree Online?
96," Attacks on computer systems have become more frequent and devastating as hackers have become more sophisticated. Graduates of information security bachelor's and master's degree programs, such as the ones outlined in this article, are in high...",Where Can I Earn an Information Assurance & Security Degree Online?
97," Online Internet security courses are available for certificate, college credit and for personal self-study for anyone wishing personal or professional enrichment. Read on to learn where you can find these online security programs and courses.",Where Can I Find an Internet Security Course Online?
98," Free online computer forensics tutorials and courses can be found at universities like the University of Washington and the University of South Florida. Topics will cover Unix systems and forensic investigation, among other things.",Where Can I Find Free Online Computer Forensics Courses?
99," Free online cyber security courses are provided by Open University, the Massachusetts Institute of Technology, and Stanford University. Students will have access to various course materials available for independent study.",Where Can I Find Free Online Cyber Security Courses?
100," Electronic crimes have accelerated in recent years, increasing the need for computer forensics professionals with the competency to help solve digital fraud, theft and abuse. Many online schools have begun offering forensic computing programs to...",Where Can I Take Forensic Computing Courses Online?
101, Network operating systems security is the initial line of defense against unauthorized intrusion into operating systems. Network administrators must typically possess the knowledge needed to employ security processes and procedures. A bachelor's...,Which Schools Offer a Network Administration & Security Bachelor's Degree?
102, Computer security degree programs are designed to show students how to implement and administer security measures and to investigate various threats that might compromise the security of a company's computer networks. Busy individuals may...,Which Schools Offer an Online Computer Security Degree Program?
103," Cybercrime refers to criminal activity involving the Internet, computer systems and information technology. Those seeking a career in this field might take coursework in cybercrime or cybersecurity as part of the curriculum of degree programs in...",Which Schools Offer Cybercrime Courses Through Online Learning?
