,Answers,Question
0," Explore your education and career options in database administration. See what topics you'll study in an associate's degree program. Get information about the career outlook in this field, including certification information and earning potential.",Associate's Degree in Database Administration
1," As a company's database administrator, you store and protect important data the organization couldn't function without. If this sounds like your ideal job, read on to find out how to enter the profession and what credentials you could earn to...",Certified Database Administrator Certification and Career Facts
2," Data analysis is utilized in many fields, and academic programs are available to train you to perform data analysis tasks in business, healthcare and computer technology. Keep reading to explore education and career paths in this field.",Data Analyst Degree Programs and Classes
3," Explore the career requirements for data architects. Get the facts about education, salary, and potential job growth to determine if this is the right career for you.",Data Architect Jobs: Salary and Career Facts
4," Data communications analysts evaluate, plan and develop networks as well as other Internet systems. Read on to learn more about education options that can help you enter this career.",Data Communications Analyst Training and Schools
5," Research what it takes to become a data communications analyst. Learn about education requirements, job duties, average wages and job outlook to find out if this is the career for you.",Data Communications Analyst: Career and Salary Facts
6," Research what it takes to become a data management analyst. Learn about education requirements, job duties, salary and job outlook to find out if this is the career for you.",Data Management Analyst Job Facts
7," Data managers, also known as database administrators, use database technology to enable users to quickly access information stored in databases. Get information on choosing a school, find out what type of degree program will qualify you to work...",Data Management Degree Programs and Courses
8," Data modeling is a way of organizing data so it can be used in a database. Find out about the courses and degrees that will aid information technology professionals, and get information on the professional certifications that are offered.",Data Modeling Classes and Training Programs
9," As a data processor, you may be responsible for inputting, formatting, editing and proofreading data in a computer system. Continue reading to learn more about education and career options, as well as salary info.",Data Processing Courses and Degree Programs
10," Find out about the types of jobs you could pursue as a data processing technician, including data-entry keyers, clerks, and medical records and health information technicians. Read on to learn more about career options along with key...",Data Processing Technician Jobs
11, Find out about the types of jobs you could pursue in data processing. Read on to learn more about career options along with education requirements and salary.,Data Processing: Career and Salary Facts
12," Research what it takes to become a Data Reporting Analyst, also known as a Management Analyst.  Learn about job duties, education requirements, employment outlook and average wages to find out if this is the career for you.",Data Reporting Analyst: Career and Salary Facts
13," Research what it takes to become a data technician. Learn about training, job duties, the job outlook and salary to find out if this is the career for you.",Data Technician: Salary and Career Facts
14," Data technology encompasses many disciplines, such as database management technology, that include designing and maintaining databases. Read on to find out more about the programs and courses available.",Data Technology Training Programs and Courses
15," Research what it takes to become a data warehouse analyst. Learn about  job responsibilities, education requirements, job outlook, and salary information to find out if this is the career for you.",Data Warehouse Analyst: Career and Salary Facts
16," Database administration requires testing, installation and maintenance of database software. Read on to learn more about training and education requirements in this field.",Database Administration Jobs: Education and Training Requirements
17," A database administrator designs, constructs and maintains the databases that secure information for an organization. There are many certificate and degree programs that offer training for this career. See your program options, look at required...",Database Administration School and Training Programs
18," Database administrators store, organize, manage and analyze data to make it more accessible and useful to companies, organizations and governments. Learn about online certificate, bachelor's and master's degree programs in this field, and compare...",Database Administration: Online Degree and Certificate Programs
19," Explore the career requirements for database administrators. Get the facts about degree requirements, salary, job outlook and job duties to determine if this is the right career for you.",Database Administrator Jobs: Salary and Career Facts
20," Explore the career requirements for database analysts. Get the facts about education and requirements, career outlook and salary to determine if this is the right career for you.",Database Analyst: Job and Salary Facts
21," Explore the career requirements for database architects. Get the facts about job duties, education requirements and salary to determine if this is the right career for you.",Database Architect Jobs: Salary and Career Facts
22, A degree program in database design can provide you with a better understanding of how databases are built. Keep reading to find out more about degree program options and content.,Database Design Degrees
23," Database developer education programs can help you learn how to design, implement and maintain your own database, data management system or data warehouse. Read about education program options, and check the career outlook.",Database Developer Degree Programs
24," Explore the career requirements for database developers. Get the facts about training and education requirements, job duties, career opportunities and salary to determine if this is the right career for you.",Database Developer: Career and Salary Facts
25, There are a handful of schools that offer certificate programs in database development. You can even complete some of these programs over the Internet. Read on to learn about education programs and the career outlook in the field.,Database Development Certificates
26," Explore the career requirements for database managers. Get the facts about education and certification requirements, salary, and potential job growth to determine if this is the right career for you.",Database Manager: Career and Salary Facts
27," In database marketing, you will analyze statistics about the economy and social trends to determine how to market goods and services. Get information on degrees that can help you in this field, see the courses you'll need to take and discover...",Database Marketing Degrees and Courses
28," Get information on the degree programs that can qualify you for a job as a database programmer, including online study options. Find out about the career options you'll have with either an undergraduate or a graduate degree.",Database Programmer School and Career Facts
29," An education in database programming provides instruction in database design and development, various database tools and network security. Read on to learn more about training options and the career outlook.",Database Programming Training and Education Programs
30," Research what it takes to become a database specialist. Learn about job duties, education requirements, employment outlook and wages to find out if this is the career for you.",Database Specialist: Career and Salary Facts
31," Explore the career requirements for database technicians. Get the facts about education and certification requirements, job duties, and salary information to determine if this is the right career for you.",Database Technician: Salary and Career Facts
32," Training for a career in the field of database technology is offered through several degree options, as well as via distance learning. For more information on database technology degree and certificate programs and your career options, read on.",Database Technology Degree and Certificate Programs
33," Explore the career requirements for data and reporting analysts. Get the facts about job duties, education requirements, key skills, and the job outlook to determine if this is the right field for you.",How Can I Become a Data and Reporting Analyst?
34," Research what it takes to become a data modeler. Learn about job duties, education requirements, job outlook and salary to find out if this is the career for you.",How Can I Become a Data Modeler?
35," Learn how you can launch a career as a database engineer or administrator. Read about the median salary, job outlook, job duties, and education requirements to find out if this is the right career for you.",How Can I Become a Database Engineer?
36," Research what it takes to become a database marketing specialist. Learn about certification and education requirements, job outlook and salary to find out if this is the career for you.",How Can I Become a Database Marketing Specialist?
37," Research what it takes to become an Oracle database administrator. Learn about licensure requirements, job duties, average wages and job outlook to find out if this is the career for you.",How Can I Become an Oracle Database Administrator?
38, Customer data integration combines the analysis of customer input with data warehousing. You may be able to learn customer data integration through various programs related to computer science and information technologies. Continue reading to...,How Can I Learn Customer Data Integration?
39," When disaster strikes a computer network, businesses and organizations need to restore and repair functions as soon as possible. You can learn the theory and techniques for using data processing aids in recovery efforts by studying computer...",How Can I Learn Data Processing for Disaster Recovery?
40, People who work in data communications help organize the communications and computer networks in an organization. Read on to discover the types of degrees that will improve your qualifications.,How Can I Train in Data Communications?
41," Do you enjoy analyzing and solving complex problems? Would you like to influence decision makers with your deductions? If so, you may be interested in reading further about a career as a consultant in data management.",How Can I Work as a Data Management Consultant?
42," There are many certifications available for becoming a certified database administrator. Many of these certifications are offered by database vendors themselves. By passing a series of tests and sometimes other requirements, you can earn a...",How Do I Become a Certified Database Administrator?
43," Explore the career requirements for data management. Get the facts about job duties, education requirements, professional licensure and the employment outlook to determine if this is the right field for you.",How Do I Become a Data Manager?
44, Oracle developers are computer technicians who work with Oracle programs and databases. These workers typically obtain a Bachelor of Science in Computer Science along with Oracle-related certifications before becoming an Oracle developer. Read on...,How Do I Become an Oracle Developer?
45, Certification in Database Administration (DBA) can give information technology professionals a competitive career edge. Read on to find out how to earn your Oracle DBA certification.,How Do I Earn an Oracle DBA Certification?
46," Find out about the types of jobs you could pursue in electronic data processing. Read on to learn more about career options along with salary, education and job growth information",Jobs in Electronic Data Processing: Salary and Career Facts
47," A database administrator designs, tests and troubleshoots databases. Learn about earning a master's degree in this field, including the prerequisites, curriculum and online availability. Find out what your job options are in this field, and...",Master's Degree Programs in Database Administration
48," Find out what you'd study in a master's degree program in data management, and check the prerequisites for enrollment. Learn what career opportunities would be open to you once you've earned your master's degree, and review the outlook and salary...",Master's Degrees in Data Management
49, Learn about the online courses that are available for individuals aspiring to become a database administrator. Find out about degrees that offer classes and how online courses are structured.,Online Courses for Aspiring Database Administrators
50, Courses in data processing are often found in information technology and business programs. Learn about online courses for data processing professionals.,Online Courses in Data Processing
51, Learn about online courses available in a computer information systems master's degree or database management certificate program. Explore course topics and how online classes work.,Online Database Systems Courses
52, Find out what kinds of Oracle classes are available online and how to enroll in them. Learn about certifications that attest to your ability with Oracle's products and what the requirements are to earn them.,Online Oracle Courses
53," Explore the career requirements for Oracle administrators. Get the facts about education requirements, certification, job duties, and salary information to determine if this is the right career for you.",Oracle Administrator: Salary and Career Facts
54, Oracle's database administrator certification requires passing an exam. Keep reading for information on certificate programs that include instruction in data management and computer programming to prepare you for the certification exam.,Oracle Certificate and Certification Programs
55," Though earning a Ph.D. in Database Administration isn't possible, you could take courses at the doctoral level. You can also pursue master's-level programs in the field. Review your options for graduate study in database administration, including...",PhD in Database Administration: Online and Campus-Based Programs
56," Earning a Doctor of Philosophy (Ph.D.) in Information Systems can provide you with an expert perspective on information technologies - including database systems - and their impact on organizations. Review the program length, coursework, online...",PhD in Database Systems
57," If you're interested in the information technology that allows users to control data storage and retrieval, consider training in relational databases. Courses in this area are usually part of computer science or information technology degree...",Relational Database Course and Degree Programs
58," Individuals who have successfully obtained Oracle certification may work in many different positions, including database administrator, application developer or financial consultant. Read on to learn more about these positions.",What are Some Career Options for People Who are Oracle Certified?
59," Systems administrators install, troubleshoot and update network and computer systems within organizations. Read on to learn more about some entry-level positions in this field.",What are Some Entry-Level Systems Administrator Jobs?
60, Data communication is the process by which different technologies communicate with one another. Completing an associate's or bachelor's degree program in computer science or information technology lays the foundation for a data communications...,What are the Basics of Data Communication?
61," Though degrees in database management and database design may be slightly different, they share a common set of core courses. This article distills courses in database management down to a core set of courses in most programs, regardless of...",What are the Core Courses of a Database Management Design Degree?
62," Though some master's degree programs in database administration differ in name, most have similar features and core courses. This article takes into account the different degrees and specializations in database administration and provides a list...",What Are the Courses in a Master's Degree in Database Administration?
63," There are a variety of online programs that offer database design educational courses and training. This article focuses on bachelor's degree programs. The courses listed relate only to database courses, and not to the entire program. Read on to...",What Are the Courses in an Online Database Design Degree Program?
64," Database managers deal in data, naturally. The management of large volumes of information is a critical part of our electronic world. Financial records, credit card accounts, billing addresses, and other customer records are all stored in...",What Does a Database Manager Do?
65," Research what it takes to become a data center manager. Learn about education requirements, job duties, average wages and job outlook to find out if this is the career for you.",What is a Data Center Manager?
66," Research what it takes to become a database development specialist. Learn about the duties of this job, the education requirements and salary range to find out if this is the career for you.",What is a Database Development Specialist?
67," Senior data warehouse analysts review, develop, maintain and store user information for companies and organizations. Keep reading to learn about degree and certification options, job duties and earnings for these analysts.",What is a Senior Data Warehouse Analyst?
68, Oracle is a relational database management system. Certification in Oracle increases an employee's visibility and upward mobility in the information technology industry. Read on to learn more about how to become certified.,What is an Oracle Certificate Program?
69," Do you want to find out how automated messages are sent, and are you interested in a career in the information technology field? If so, then read on learn more about automated data processing and some careers related to the technology.",What is Automated Data Processing?
70," Much of today's computer use is predicated on the ability to transfer data quickly across both small and large distances. If you worked in data communication systems technology, you would design and execute the structures that allow information...",What is Data Communication Systems Technology?
71, Data processing management involves managing data on a digital platform. You'll need both business and technical skills as well as the ability to lead a team in a demanding environment. Read on to determine if a career in data processing...,What is Data Processing Management?
72, Data resource management involves the management of files and computer data for businesses and companies. Read on to learn career and education information about the field of data resource management along with some salary and job growth...,What is Data Resource Management?
73, Database administration is the act of supervising and maintaining database management system software. Professionals in this field usually need a bachelor's degree and work experience. Read on to learn more about database administration and the...,What is Database Administration?
74, Database architecture uses programming languages to design a particular type of software for businesses or organizations. A postsecondary education is typically required for employment in this discipline. Read on to learn more about database...,What is Database Architecture?
75, Database optimization refers to a variety of strategies for reducing database system response time. Read on to learn more about database optimization and the professionals who manage databases in a wide range of industries.,What is Database Optimization?
76," Find out about the types of jobs you could pursue that involve Experimental Data Analyst software. Read on to learn more about how this software works, along with career and salary information.",What is Experimental Data Analyst?
77," Logical database design involves creating a data model that shows an organization's information. If you think you might be interested in a career working with logical database design, read on to learn more about the education and career options.",What is Logical Database Design?
78, SharePoint is a platform from Microsoft consisting of a broad range of online technologies and tools. Database administration for SharePoint involves developing and monitoring information for local and distance access. Continue reading to learn...,What is SharePoint Database Administration?
79, Structured Query Language (SQL) is the fundamental programming language for databases and is the foundation of nearly every commercial and proprietary database program. Read on to learn more about this computer programming language.,What is SQL?
80, Database management courses traditionally provide a hands-on learning experience designed to develop basic and advanced programming skills. Read on for more information about courses and programs in this field.,What Skills Will I Learn in a Database Management Course?
81, Structured query language (SQL) is a programming language that is used to access and manipulate databases. Read on to learn more about this computer programming language and the skills needed to use it.,What Skills Will I Learn in a SQL Training Course?
82," Before one begins a career in database management, earning a bachelor's degree in management information systems, computer science or information technology would be a good idea. Read on to learn more about how to enter the database management...",What Training Is Needed for a Career in Database Management?
83," The curriculum of a database administration degree program typically covers network management, programming, data storage and other topics related to information technology. Read on to learn more about these programs.",What Will I Learn in a Database Administration Degree Program?
84," Oracle Certified Professionals (OCP) can specialize in a wide variety of areas, each of which has its own training course requirements. If you would like to pursue initial or additional training as an Oracle Certified Professional, read on to...",What Will I Learn in an OCP Training Program or School?
85," If you are interested in working as an Oracle database administrator, you often can find training through tutorial programs. Read on to find out about the information is covered in the Oracle database administration (DBA) tutorial programs.",What Will I Learn in an Oracle DBA Tutorial?
86, Information retrieval programs and courses can train you to create database indexes and manipulate search engine results. Continue reading if you're interested in pursuing a career as an information analyst or search engineer.,What Will I Learn in Information Retrieval Training Programs?
87, The curriculum for a bachelor's degree in database technology includes computer programming and networking as well as computer configuration courses. Read on to learn more about the curriculum of these programs.,What's the Curriculum of a Database Technology Bachelor's Degree?
88," Students enrolled in a Master of Science in Database Management program generally learn some form of database security procedures, data mining, inheritance hierarchy and object-oriented analysis. Read on to learn more about the curriculum of a...",What's the Curriculum of a Master's Degree in Database Management?
89," The curriculum of an associate's degree in database technology covers programming languages for databases as well as database structure, creation and applications. Read on to learn more at these course topics.",What's the Curriculum of an Associate Degree in Database Technology?
90, Information technology (IT) professionals who are experienced in database administration might be interested in earning a Microsoft SQL (Structured Query Language) certification to help them get ahead in their careers. Read on to learn more.,Where Can I Earn a Microsoft SQL Certification?
91," Microsoft database certification training is available from a number of sources, including education institutions and Microsoft itself. Read on to learn more about these certifications and training.",Where Can I Find Microsoft Database Certification Programs?
92," Online courses in Oracle database technologies teach students to efficiently and securely operate database systems using Oracle, one of the world's leading database platforms. Read on to learn more about these online courses.",Where Can I Find Online Courses in Oracle Database Technologies?
93," SQL (Structured Query Language) is used to manage relational database systems. Online training in SQL allows anyone, from a beginner trying to enter the field to a database manager looking for career advancement, to acquire necessary SQL skills.",Where Can I Find Online Training in SQL?
94," Database administration includes the storage, organization and retrieval of data as well as the performance of backup and database security functions. Read on to learn more about two schools that offer degrees in this field online.",Which Colleges Offer a Database Administration Degree Online?
